NO_PRESTADOR;FANTASIA;NUMERO;LOGRADOURO;BAIRRO;MUNICIPIO;UF;REGIAO_SAUDE;ESPECIALIDADES;TELEFONE1;TELEFONE2
MAGALI TERRA RIBEIRO ME;LABORATORIO BIOMEDICO;37;MONSENHOR ESTANISLAU WOLSKI;CENTRO;ROQUE GONZALES;RS;CRS 12 Santo Ângelo;PATOLOGIA CLINICA / MEDICINA LABORATORIAL;33651130;
MAIZA P PEREIRA FISIOTERAPIA;MAIZA FISIOTERAPIA;6;AVENIDA CORONEL COLARES MOREIRA;RENASCENÇA;SAO LUIS;MA;Ilha do Maranhão;FISIOTERAPIA;;
MAKARIOS CENTRO TERAPEUTICO BRINCANTO LTDA;MAKARIOS CENTRO TERAPEUTICO BRINCANTO;14;AVENIDA RIO JUTAÍ;NOSSA SENHORA DAS GRAÇAS;MANAUS;AM;Entorno de Manaus;PSICOLOGIA  / ASSISTENCIA A PESSOAS PORTADORAS DE DEFICIENCIAS  / FONOAUDIOLOGIA  / TERAPIA OCUPACIONAL / FISIOTERAPIA;;
MAKARIOS ESPACO TERAPEUTICO BRINCANTO LTDA;ESPACO TERAPEUTICO BRINCANTO;1544;AVENIDA VILLE ROY;CAÇARI;BOA VISTA;RR;Secretaria Estadual de Saúde;PSICOLOGIA  / NUTRICAO / FONOAUDIOLOGIA  / FISIOTERAPIA / TERAPIA OCUPACIONAL;;
MAKARIOS TERAPEUTICO ESPACO BRINCANTO LTDA;BRINCANTO MANAUS;124;AVENIDA RIO JUTAÍ;NOSSA SENHORA DAS GRAÇAS;MANAUS;AM;Entorno de Manaus;TERAPIA OCUPACIONAL / FONOAUDIOLOGIA  / PSICOLOGIA  / FISIOTERAPIA / ASSISTENCIA A PESSOAS PORTADORAS DE DEFICIENCIAS;;
MANOEL YASSUO MOCHIDA;LABORATORIO OSWALDO CRUZ;0;ITAIPU;VILA PERMANENTE;TUCURUI;PA;Lago Tucuruí;PATOLOGIA CLINICA / MEDICINA LABORATORIAL;37871239;
MARCELLA SILVEIRA BARBOSA ARAUJO;MARCELLA SILVEIRA BARBOSA ARAUJO;118;RUA DOUTOR JOSÉ AFFONSO DE MELLO;JATIÚCA;MACEIO;AL;Região 01;FISIOTERAPIA;;
MARCELLI F PEREIRA CORREA LIBANIO;REABILITA CENTER;38;SENADOR CAMARA;FEDERAL;SAO LOURENCO;MG;Varginha;FISIOTERAPIA;;
MARCIA OLIVEIRA VOGADO;" 	MARCIA OLIVEIRA VOGADO";702;AVENIDA GUARAPUAVA;CONJUNTO JOSÉ VALLIM DE MELO;UBERABA;MG;Uberaba;FISIOTERAPIA;;
MARCOS PALOMBINI MEDEIROS;MARCOS PALOMBINI MEDEIROS;113;RUA PRIMEIRO DE MARCO;CENTRO;SAO LEOPOLDO;RS;CRS 01 Porto Alegre;ORTOPEDIA E TRAUMATOLOGIA;;
MARGARETH DIAS SERAFIM;VIDA ATIVA;997;RUA SALVADOR;VILA MAGNOLIA;ARACUAI;MG;Diamantina;FISIOTERAPIA / NUTRICAO;;
MARIA FERNANDA SANTOS VIEIRA;MARIA FERNANDA SANTOS VIEIRA;752;RUA VINTE;CENTRO;ITUIUTABA;MG;Ituiutaba;NUTRICAO;;
MARIANA ALMEIDA BRAGA;CRIAR TERAPIA OCUPACIONAL PEDIATRICA;140;RUA ANDRÉ VIDAL DE NEGREIROS;PONTA DA PRAIA;SANTOS;SP;Baixada Santista;FONOAUDIOLOGIA  / TERAPIA OCUPACIONAL / PSICOLOGIA;32615133;
MARIANA MARTINES INOCENCIO;MARIANA MARTINES INOCENCIO;2221;RUA VOLUNTÁRIOS DA FRANCA;SÃO JOSÉ;FRANCA;SP;Franca;PSICOLOGIA;;
MARIANA NORONHA CASTRO MENDES;;830;RUA GENERAL JOAQUIM INÁCIO;ILHA DO LEITE;RECIFE;PE;Recife;GINECOLOGIA E OBSTETRICIA;;
MARINA AMORIM PSICOLOGIA LTDA;MARINA AMORIM PSICOLOGIA LTDA;70;RUA MISAEL PEDREIRA DA SILVA;SANTA LÚCIA;VITORIA;ES;SR Vitória;PSICOLOGIA;;
MARINA BRASIL CIRILO DA SILVA;MARINA OFTALMOLOGIA SERVICOS MEDICOS;434;RUA BENTO GOLÇALVES;CENTRO;FLORES DA CUNHA;RS;CRS 05 Caxias do Sul;OFTALMOLOGIA;;
MARINA ROCHA PORDEUS DOS SANTOS;MARINA ROCHA PORDEUS DOS SANTOS;11;RUA JOSÉ MARTINS IRMÃO;GATO PRETO;SOUSA;PB;X Núcleo Regional de Saúde;NUTRICAO;;
MARINA XAVIER DE MIRANDA POMPEU;MARINA XAVIER DE MIRANDA POMPEU;381;AVENIDA ÁLVARES CABRAL;LOURDES;BELO HORIZONTE;MG;Belo Horizonte;PSICOLOGIA;;
MARINALVA FLORES VALENSUELA;MARINALVA FLORES VALENSUELA;118;RIO BRILHANTE;SAO PEDRO - JARDIM;DOURADOS;MS;NCT de Dourados;PSICOLOGIA;;
MARLIZETE LEOPOLDINA BEZERRA;;5025;AVENIDA CONSELHEIRO AGUIAR;BOA VIAGEM;RECIFE;PE;Recife;GINECOLOGIA E OBSTETRICIA;34659093;
MARTHINA BASTOS DE MORAES;MARTHINA BASTOS DE MORAES;2366;RUA PINHEIRO MACHADO;CENTRO;SANTA MARIA;RS;CRS 04 Santa Maria;PEDIATRIA;;
MATHEUS GONCALVES VIEIRA GOMES BANDEIRA LTDA;STUDIO VOLL;178;RUA LUIZ RAZERA;NOVA AMÉRICA;PIRACICABA;SP;Piracicaba;FISIOTERAPIA;;
MATIAS DIGESTIVA LTDA;MATIAS DIGESTIVA LTDA;3650;AVENIDA BERNARDO SAYÃO;MARANHÃO NOVO;IMPERATRIZ;MA;Tocantins;GASTROENTEROLOGIA  / PSICOLOGIA  / COLOPROCTOLOGIA / CIRURGIA DO APARELHO DIGESTIVO / CIRURGIA GERAL;;
MAX DAY HOSPITAL LTDA;MAX DAY HOSPITAL;251;AVENIDA REPÚBLICA DO LÍBANO;PINA;RECIFE;PE;Recife;OTORRINOLARINGOLOGIA  / CIRURGIA VASCULAR / MASTOLOGIA  / DERMATOLOGIA   / OFTALMOLOGIA  / CIRURGIA DA MÃO / ORTOPEDIA E TRAUMATOLOGIA  / CIRURGIA DO APARELHO DIGESTIVO / UROLOGIA  / CIRURGIA PEDIATRICA  / GASTROENTEROLOGIA  / CIRURGIA DE CABEÇA E PESCOÇO / CIRURGIA CARDIOVASCULAR  / ANGIOLOGIA / CIRURGIA PLÁSTICA / GINECOLOGIA E OBSTETRICIA  / CIRURGIA E TRAUMATOLOGIA BUCO-MAXILO-FACIAIS / CIRURGIA TORACICA  / NEUROCIRURGIA  / CIRURGIA GERAL;20114050;
MAYARA PEREIRA VASCONCELOS;;95;RUA DOUTOR EDUARDO MACHADO METELLO;CHÁCARA CACHOEIRA;CAMPO GRANDE;MS;NCT de Campo Grande;NUTRICAO;30222105;
MD MELO SERVICOS MEDICOS LTDA;MD MELO SERVICOS MEDICOS LTDA;3833;AVENIDA BRIGADEIRO EDUARDO GOMES;MECEJANA;BOA VISTA;RR;Secretaria Estadual de Saúde;OTORRINOLARINGOLOGIA;;
MD ODONTOLOGIA INTEGRADA LTDA ME;MD ODONTOLOGIA;3244;AVENIDA ANTÔNIO CARLOS MAGALHÃES;PITUBA;SALVADOR;BA;Salvador;CIRURGIA E TRAUMATOLOGIA BUCO-MAXILO-FACIAIS;34940909;
ME FISIOTERAPIA E SAUDE LTDA;FISIOCARDIO;5835;RUA DAS ORQUÍDEAS;ELDORADO;PORTO VELHO;RO;Departamento de Epidemiologia;FISIOTERAPIA;;
MED AMORE LTDA;MED AMORE;288;RUA FENELON BONAVIDES;BRASÍLIA;PATOS;PB;VI Núcleo Regional de Saúde;GINECOLOGIA E OBSTETRICIA;;
MED CENTER AQUIRAZ SERVICOS MEDICOS LTDA;MED LESTE;97;R JOAO PAULO II;CENTRO;AQUIRAZ;CE;Fortaleza;CARDIOLOGIA  / RADIOLOGIA E DIAGNÓSTICO POR IMAGEM / CIRURGIA GERAL  / GINECOLOGIA E OBSTETRICIA  / COLOPROCTOLOGIA / UROLOGIA  / FISIOTERAPIA / PEDIATRIA;;
MEDCLIN CLINICA MEDICA LTDA;MEDCLIN;123;QUINTINO BOCAIÚVA;CENTRO;MOSSORO;RN;II ETAM;ENDOCRINOLOGIA E METABOLOGIA / PSICOLOGIA  / FISIOTERAPIA / NUTRICAO;;
MEDEIROS SERVICOS MEDICOS LTDA;MEDEIROS SERVICOS MEDICOS LTDA;;;;;;;CIRURGIA GERAL;;
MEDICAL TEAM SERVICOS MEDICOS LTDA;MEDICAL TEAM SERVICOS MEDICOS;3558;RUA VERGUEIRO;VILA MARIANA;SAO PAULO;SP;Grande São Paulo;CIRURGIA PLÁSTICA;21576265;
MEDICINA DO SONO AM SERVICOS MEDICOS LTDA;MEDICINA DO SONO AM SERVICOS MEDICOS LTDA;243;RUA RAIMUNDO POLARI;PARQUE 10 DE NOVEMBRO;MANAUS;AM;Entorno de Manaus;NEUROLOGIA;;
MEDICINA INTEGRAL LTDA;MEDICINA INTEGRAL;100;AVENIDA FRANCISCA RICARDINA DE PAULA;ALFREDO CUSTÓDIO DE PAULA;POUSO ALEGRE;MG;Pouso Alegre;GERIATRIA   / NEUROCIRURGIA  / NEFROLOGIA  / NUTRICAO / CARDIOLOGIA  / FONOAUDIOLOGIA  / RADIOLOGIA E DIAGNÓSTICO POR IMAGEM / HOMEOPATIA  / CLÍNICA MÉDICA;30258127;
MEDICUS24H SERVICOS E ATIVIDADES DE APOIO A SAUDE LTDA;MEDICUS24H;739;RUA QUINTINO BOCAIÚVA;CENTRO;JOAO PESSOA;PB;I Núcleo Regional de Saúde;CLÍNICA MÉDICA / REMOCOES;33400425;
MEDIX CLINICA MEDICA ESPECIALIZADA LTDA;MEDIX CLINICA MEDICA ESPECIALIZADA;20;RUA MELCHIOR HEIL;CENTRO I;BRUSQUE;SC;Brusque;FISIOTERAPIA / PSIQUIATRIA  / CIRURGIA DE CABEÇA E PESCOÇO / NUTRICAO / ANESTESIOLOGIA  / NEUROCIRURGIA  / CIRURGIA ONCOLÓGICA / COLOPROCTOLOGIA / INFECTOLOGIA  / CIRURGIA VASCULAR / CIRURGIA GERAL  / ORTOPEDIA E TRAUMATOLOGIA  / UROLOGIA  / CARDIOLOGIA  / GINECOLOGIA E OBSTETRICIA;;
MEDLAB RIO BRANCO LTDA ME;MEDLAB RIO BRANCO;35;RUA. CASTRO ALVES;BOSQUE;RIO BRANCO;AC;Acre;PATOLOGIA CLINICA / MEDICINA LABORATORIAL;32244246;32245150
MEDSIM SERVICOS MEDICOS E HOSPITALARES;MEDSIM SERVICOS MEDICOS E HOSPITALARES LTDA;843;AVENIDA DAS FLORES;JARDIM CUIABÁ;CUIABA;MT;Baixada Cuiabana;GASTROENTEROLOGIA;;30287328
MEDSOLUTION ATIVIDADES MEDICAS LTDA;MEDIALISE CENTRO DE HEMODIALISE SAO VICENTE;175;TREZE DE MAIO;CENTRO;SAO VICENTE;SP;Baixada Santista;NEFROLOGIA;34678179;
MEDSONO - CENTRO DE OTORRINOLARINGOLOGIA E MEDICINA DO SONO;MEDSONO;223;AVENIDA R 1;SETOR OESTE;GOIANIA;GO;Central;OTORRINOLARINGOLOGIA;;39242400
MEDSONO CENTRO DE OTORRINOLARINGOLOGIA E MEDICINA DO SONO LTDA;MEDSONO;2;DIOGO BERNARDES;ALEIXO;MANAUS;AM;Entorno de Manaus;OTORRINOLARINGOLOGIA;;
MEIRELLES CEDRO SERVICOS MEDICOS SS;CDR DIAGNOSTICOS;58;AVENIDA RUY BARBOSA;CENTRO;EUNAPOLIS;BA;Eunápolis;RADIOLOGIA E DIAGNÓSTICO POR IMAGEM / CIRURGIA CARDIOVASCULAR;;
MELINA MARIA BATISTA SILVA;;11;RUA JOSÉ MARTINS IRMÃO;GATO PRETO;SOUSA;PB;X Núcleo Regional de Saúde;ENDOCRINOLOGIA E METABOLOGIA;;
MENDES E TERRA SERVICO DE PSICOLOGIA LTDA;COLORIDAMENTE CLINICA DE PSICOLOGIA;429;AVENIDA DOUTOR JOÃO GUILHERMINO;CENTRO;SAO JOSE DOS CAMPOS;SP;Taubaté;FONOAUDIOLOGIA  / TERAPIA OCUPACIONAL / FISIOTERAPIA / PSICOLOGIA;39223066;
MENTALIS LTDA;MENTALIS;376;AVENIDA CORONEL PRATES;CENTRO;MONTES CLAROS;MG;Montes Claros;NUTRICAO / PSICOLOGIA;32163234;
MG CLINICA DE FISIOTERAPIA LTDA;CENTROFISIO;789;GENERAL OSORIO;CENTRO;PANAMBI;RS;CRS 17 Ijuí;FISIOTERAPIA;33750933;
MH SERVICOS MEDICOS LTDA;CLINDOR ORTOPEDIA CLINICA DA DOR;1370;AVENIDA DAS CASTANHEIRAS;NORTE (ÁGUAS CLARAS);BRASILIA;DF;Distrito Federal;RADIOLOGIA E DIAGNÓSTICO POR IMAGEM / ORTOPEDIA E TRAUMATOLOGIA;35261318;
MICHELE APARECIDA ZAMIAN DE BARROS;MICHELE APARECIDA ZAMIAN DE BARROS;594;RUA PEDRO DE TOLEDO;CENTRO;LINS;SP;Bauru;PSICOLOGIA;;
MICHELE DE FATIMA REZENDE;MICHELE DE FATIMA REZENDE;348;RUA RUY BARBOSA;CENTRO;LAVRAS;MG;Varginha;NUTRICAO;;
MICHELLE SCHENATTO DE MARCO NUTRICIONISTA;NUTRICIONISTA MICHELLE SCHENATTO DE MARCO;2383;ARTHUR OSCAR;GRAMADINHO;SERAFINA CORREA;RS;CRS 06 Passo Fundo;NUTRICAO;;
MICHELLY ADELAIDE THIESEN CLINICA DE PSICOLOGIA;MICHELLY ADELAIDE THIESEN CLINICA DE PSICOLOGIA;467;RUA VISCONDE DE NACAR;CENTRO HISTÓRICO;PARANAGUA;PR;Paranaguá;PSICOLOGIA;;
MIGUEL MARTINS RODRIGUES NETO - ME;DR MIGUEL M R NETO;2073;AVENIDA PAULISTA;BELA VISTA;SAO PAULO;SP;Grande São Paulo;PSIQUIATRIA;32853924;
MIKAELLY DUARTE SANTOS SOUZA;MIKAELLY DUARTE S SOUZA;508;RODOVIA ENGENHEIRO JOAQUIM GONÇALVES, PENEDO/AL;SANTA LUZIA;PENEDO;AL;Região 02;FISIOTERAPIA;;
MILAGRES HELENO OFTALMOLOGIA LTDA;INSTITUTO DA CATARATA;167;RUA VISCONDE DE ARAGUAIA;SÃO JOSÉ;BARBACENA;MG;Barbacena;OFTALMOLOGIA;;
MILENA MACHADO SANTOS;MILENA MACHADO SANTOS;1917;RUA FLORIANO PEIXOTO;SANTOS DUMONT;SAO JOSE DO RIO PRETO;SP;São José do Rio Preto;PSICOLOGIA  / TERAPIA OCUPACIONAL / FONOAUDIOLOGIA;;
MINI MUNDO LTDA;WEYDNA FREITAS;164;AVENIDA DÁRIO RABELO;7 DE SETEMBRO;IGUATU;CE;Iguatu;ASSISTENCIA A PESSOAS PORTADORAS DE DEFICIENCIAS  / FISIOTERAPIA / PSICOLOGIA;;
MIRELLE ARAUJO CASAGRANDE;MIRELLE ARAUJO CASAGRANDE;141;FERNANDO MACHADO;CENTRO;CHAPECO;SC;Chapecó;PSICOLOGIA;;
MIRIA AVILA RIBEIRO;;33;SUELY BARBOSA ABREU;ZONA SUL;SAO GABRIEL;RS;CRS 10 Alegrete;ASSISTENCIA A PESSOAS PORTADORAS DE DEFICIENCIAS;;
MIT MEDICINA INTEGRAL DO TRABALHADOR LTDA;MIT MEDICINA INTEGRAL DO TRABALHADOR;2855;RUA MONTE ALEGRE;VILA PLANALTO;DOURADOS;MS;NCT de Dourados;MEDICINA DO TRABALHO;34167200;
MJ ESPECIALIDADES LTDA;MJ ESPECIALIDADES;850;SANTOS DUMONT;SAO SEBASTIAO;UBERABA;MG;Uberaba;NEUROCIRURGIA  / ORTOPEDIA E TRAUMATOLOGIA;33110100;
MKG DIAGNOSTICOS POR IMAGEM LIMITADA;MKG;294;RUA ROBERTO LAMBACH FALAVINHA;FÁTIMA;COLOMBO;PR;Metropolitana;CARDIOLOGIA  / MEDICINA DA FAMÍLIA E COMUNIDADE / GINECOLOGIA E OBSTETRICIA  / PEDIATRIA  / CLÍNICA MÉDICA / CIRURGIA VASCULAR / PSIQUIATRIA  / ORTOPEDIA E TRAUMATOLOGIA  / RADIOLOGIA E DIAGNÓSTICO POR IMAGEM / PSICOLOGIA  / DERMATOLOGIA;32490929;
MONICA BRAGA PSICOLOGIA LTDA;BRAGA PSICOLOGIA;24;RUA NORONHA TORREZÃO;SANTA ROSA;NITEROI;RJ;Metropolitana II;PSICOLOGIA;;
MONICA DE OLIVEIRA TREVISAN;MONICA DE OLIVEIRA TREVISAN;976;AVENIDA DOS TARUMÃS;SETOR RESIDENCIAL SUL;SINOP;MT;Sinop;CARDIOLOGIA;35332130;
MOREIRA RODRIGUES E ROLLS LTDA;MOREIRA RODRIGUES E ROLLS LTDA;650;AVENIDA DOUTOR JÚLIO RODRIGUES;MARAJOARA;TEOFILO OTONI;MG;Teófilo Otoni;PEDIATRIA;35215886;
MR SERVICOS DE NEFROLOGIA LTDA;MR SERVICOS DE NEFROLOGIA;788;RUA DA CONSTITUIÇÃO;NOSSA SENHORA DA ABADIA;UBERABA;MG;Uberaba;NEFROLOGIA;;
MUCCI MEDICINA LABORATORIAL LTDA;LAB CENTER LABORATORIO DE ANALISES CLINICAS;194;AV DR JOSE GROSSI;GUARAPIRANGA;PONTE NOVA;MG;Ponte Nova;PATOLOGIA CLINICA / MEDICINA LABORATORIAL / PATOLOGIA;;
MULTI CLINICA LTDA;MULTI CLINICA;12;JUCELINO KUBITSCHEIK;JARDIM AMERICA;ACAILANDIA;MA;Carajás;GINECOLOGIA E OBSTETRICIA  / GASTROENTEROLOGIA  / REUMATOLOGIA  / CLÍNICA MÉDICA / RADIOLOGIA E DIAGNÓSTICO POR IMAGEM / OTORRINOLARINGOLOGIA  / PEDIATRIA;;
MULTI MAIS CLINICA SERVICOS DE SAUDE LTDA;MULTI MAIS CLINICA;2238;AVENIDA GODOFREDO MACIEL;MARAPONGA;FORTALEZA;CE;Fortaleza;FISIOTERAPIA / FONOAUDIOLOGIA  / TERAPIA OCUPACIONAL / PSICOLOGIA;;
MULTI SABER LTDA;CLINICA SABER;1440; ANTÔNIO FELIPE;CENTRO;PARANAVAI;PR;Paranavaí;TERAPIA OCUPACIONAL / PSICOLOGIA  / NUTRICAO / FISIOTERAPIA / FONOAUDIOLOGIA;20900040;
MULTITEA INTERVENCAO COMPORTAMENTAL MULTIPROFISSIONAL LTDA;MULTITEA;1448;AVENIDA INDEPENDÊNCIA;PANAZZOLO;CAXIAS DO SUL;RS;CRS 05 Caxias do Sul;FISIOTERAPIA / TERAPIA OCUPACIONAL / PSICOLOGIA  / NUTRICAO / FONOAUDIOLOGIA;;
MUNIZ VERISSIMO PSICOTERAPIAS ESPECIALIZADAS LTDA;AME PSICOLOGIA;1037;RUA ABEL PEREIRA DE CASTRO;SETOR CENTRAL;RIO VERDE;GO;Sudoeste I;PSICOLOGIA;;
MW CLINIC LTDA;MW CLINIC;240;AVENIDA GENTIL MESSIAS - KITATE;VILA CRUZ;POCOS DE CALDAS;MG;Pouso Alegre;CARDIOLOGIA;;
MYALO CLINICA MEDICA LTDA;VANGUARDA MEDICINA PERSONALZADA;795;AVENIDA GETÚLIO VARGAS;CENTRO;DIVINOPOLIS;MG;Divinópolis;PSIQUIATRIA  / PSICOLOGIA  / NUTRICAO;35120992;
N M PSICOLOGIA LTDA;CLINICA VIA DA ESCUTA;3033;RUA PARANÁ;CENTRO;CASCAVEL;PR;Cascavel;PSICOLOGIA;;
N S CLINICA MEDICA LTDA;ATEND JA JOINVILLE;331;RUA ALEXANDRE DÖHLER;CENTRO;JOINVILLE;SC;Joinville;OTORRINOLARINGOLOGIA  / ORTOPEDIA E TRAUMATOLOGIA  / CARDIOLOGIA  / NUTROLOGIA / NEUROLOGIA  / PSICOLOGIA  / DERMATOLOGIA   / GINECOLOGIA E OBSTETRICIA  / OFTALMOLOGIA;30300373;
N THAIS DE B DE A RAMOS;CENTRO DE TERAPIA ABA TE ACOLHER;217;BOM JESUS;CENTRO;BALSAS;MA;Gerais de Balsas;PSICOLOGIA;;
NALZITA SOARES PEREIRA;NALZITA SOARES PEREIRA;420;AVENIDA PRIMEIRO DE JUNHO;CENTRO;DIVINOPOLIS;MG;Divinópolis;PSICOLOGIA;;
NANACLIN NUCLEO DE PSICOLOGIA E SAUDE LTDA;NANACLIN;31;RUA MAJOR PINHEIRO FRANCO;CENTRO;MOGI DAS CRUZES;SP;Grande São Paulo;NEUROLOGIA  / PSICOLOGIA  / PSIQUIATRIA  / NUTRICAO / FONOAUDIOLOGIA  / TERAPIA OCUPACIONAL;28150400;
NANONEURO SERVICOS MEDICOS LTDA;NANONEURO SERVICOS MEDICOS LTDA;4785;AVENIDA AFONSO PENA;SANTA FÉ;CAMPO GRANDE;MS;NCT de Campo Grande;NEUROCIRURGIA;;
NARA ANDREETTA SERVICOS MEDICOS LTDA;NARA ANDREETTA SERVICOS MEDICOS LTDA;230;RUA DOUTOR ORLANDO FEIRABEND FILHO;PARQUE RESIDENCIAL AQUARIUS;SAO JOSE DOS CAMPOS;SP;Taubaté;DERMATOLOGIA;39421134;
NASORRI FERREIRA S S LTDA;CLINICA NASORRI;1405;RUA MARANHÃO;CENTRO;CATANDUVA;SP;São José do Rio Preto;OFTALMOLOGIA;35253139;
NATALIA BENVEGNU;NATALIA BENVEGNU;63;AVENIDA RIO BRANCO;CENTRO;GARIBALDI;RS;CRS 05 Caxias do Sul;PSICOLOGIA;;
NATHANA SILVA COSTA;DRA NATHANA SILVA COSTA;186;RUA CRISTIANO VICTOR;SÃO JOÃO;CATALAO;GO;Estrada de Ferro;DERMATOLOGIA;;
NEFROCLINICAS CURITIBA SERVICO DE NEFROLOGIA E DIALISE SA;NEFROCLINICAS CURITIBA SERVICO DE NEFROLOGIA E DIA;70;RUA GOIÁS;ÁGUA VERDE;CURITIBA;PR;Metropolitana;NEFROLOGIA;31236550;
NEIZA BEZERRA DOS SANTOS GALVAO PSICOLOGIA;Psicoclim Atendimento Psicológico e Multiprofissio;133;RUA EDUARDO TOMANIK;CHÁCARA URBANA;JUNDIAI;SP;Campinas;PSICOLOGIA;45225842;
NELL VITA FISIOTERAPIA LTDA;NELL VITA FISIOTERAPIA LTDA PIRACICABA;1446;DONA JANE CONCEICAO;PAULISTA;PIRACICABA;SP;Piracicaba;FISIOTERAPIA;33776958;
NEND - NUCLEO ESPECIALIZADO EM NEURODESENVOLVIMENTO LTDA;NEND - NUCLEO ESPECIALIZADO EM NEURODESENVOLVIMENT;2526;AVENIDA MARCOLINO MARTINS CABRAL;CENTRO;TUBARAO;SC;Tubarão;FISIOTERAPIA / TERAPIA OCUPACIONAL / FONOAUDIOLOGIA  / PSICOLOGIA;;
NEOCENTER UTIP;NEOCENTER UTIP;9530;AVENIDA DO CONTORNO, 9530;BARRO PRETO;BELO HORIZONTE;MG;Belo Horizonte;CIRURGIA DO APARELHO DIGESTIVO / NEFROLOGIA  / GASTROENTEROLOGIA  / GENETICA MÉDICA / PSICOLOGIA  / FONOAUDIOLOGIA  / CIRURGIA PEDIATRICA  / CIRURGIA DA MÃO / COLOPROCTOLOGIA / NEUROLOGIA  / MEDICINA NUCLEAR  / CLÍNICA MÉDICA / CIRURGIA VASCULAR / PATOLOGIA / PNEUMOLOGIA  / INFECTOLOGIA  / CARDIOLOGIA  / ENDOCRINOLOGIA E METABOLOGIA / CIRURGIA TORACICA  / CIRURGIA CARDIOVASCULAR  / ORTOPEDIA E TRAUMATOLOGIA  / DERMATOLOGIA   / CIRURGIA PLÁSTICA / UROLOGIA  / ENDOSCOPIA / ANESTESIOLOGIA  / NEUROCIRURGIA  / PATOLOGIA CLINICA / MEDICINA LABORATORIAL / REUMATOLOGIA  / ALERGIA E IMUNOLOGIA  / MEDICINA INTENSIVA / CIRURGIA GERAL  / PEDIATRIA  / HEMATOLOGIA E HEMOTERAPIA / FISIOTERAPIA / RADIOLOGIA E DIAGNÓSTICO POR IMAGEM / CIRURGIA DE CABEÇA E PESCOÇO;39727241;
NEURO KIDS PASSO FUNDO LTDA;NEURO KIDS;2950;RUA MOROM;BOQUEIRÃO;PASSO FUNDO;RS;CRS 06 Passo Fundo;NUTRICAO / TERAPIA OCUPACIONAL / PSICOLOGIA  / FISIOTERAPIA / FONOAUDIOLOGIA;36322960;
NEUROCARDIO CLINICA DE NEUROLOGIA E CARDIOLOGIA;INSTITUTO GLASS DE NEUROLOGIA E CARDIOLOGIA;496;EXPEDICIONARIOS;ESCOLA NORMAL;VITORIA DA CONQUISTA;BA;Vitória da Conquista;ORTOPEDIA E TRAUMATOLOGIA  / PNEUMOLOGIA  / NEUROLOGIA  / CARDIOLOGIA;21014810;
NEUROCARDIO CLINICA DE NEUROLOGIA E CARDIOLOGIA;INSTITUTO GLASS DE NEUROLOGIA E CARDIOLOGIA;496;AVENIDA EXPEDICIONÁRIOS;RECREIO;VITORIA DA CONQUISTA;BA;Vitória da Conquista;ORTOPEDIA E TRAUMATOLOGIA  / PNEUMOLOGIA  / NEUROLOGIA  / CARDIOLOGIA;34219528;
NEUROCHIRUGIE.ME CLINICA NEUROCIRURGICA LTDA;NEUROCHIRURGIE ME CLINICA NEUROCIRURGICA PIRACICAB;109;RUA PROFESSOR LUIZ CURIACOS;CIDADE JARDIM;PIRACICABA;SP;Piracicaba;NEUROCIRURGIA;34222985;
NEUROFISIOKIDS REABILITACAO NEUROMOTORA E RESPIRATORIA LTDA;NEUROFISIOKIDS REABILITACAO NEUROMOTORA E RESPIRAT;228;AVENIDA PRIMEIRO DE MAIO;JARDIM SÃO BENTO;CAMPO GRANDE;MS;NCT de Campo Grande;FISIOTERAPIA;;
NEUROGRAPHIC SERVICOS MEDICOS E EXAMES;CLINICA NEUROGRAPHIC;12;RUA ACRE;NOSSA SENHORA DAS GRAÇAS;MANAUS;AM;Entorno de Manaus;NEUROLOGIA;;
NEURONUTRIR SERVICOS DE NUTRICAO LTDA;NEURONUTRIR;724;RUA PEDRO CELESTINO;JARDIM AMÉRICA;DOURADOS;MS;NCT de Dourados;NUTRICAO;;
NEUROPSI SONIA FERNANDES LTDA;NEUROPSI SONIA FERNANDES;1460;AVENIDA CONSELHEIRO ROSA E SILVA;GRAÇAS;RECIFE;PE;Recife;NEUROLOGIA;;
NEUSA MARIA ZANCHETTI;NEUSA MARIA ZANCHETTI;230;RUA MARECHAL DEODORO;CENTRO;BENTO GONCALVES;RS;CRS 05 Caxias do Sul;PSICOLOGIA;;
NIKOLAS HIGA BENITES;;1341;RUA PAES LEME;CENTRO;ANDRADINA;SP;Araçatuba;ORTOPEDIA E TRAUMATOLOGIA;37231455;
NORMANHA SERVICOS DE DIAGNOSTICOS POR IMAGEM LTDA;AURA DIAGNOSTICOS;1000;AVENIDA GOIÁS;SETOR CENTRAL;GOIANIA;GO;Central;RADIOLOGIA E DIAGNÓSTICO POR IMAGEM;39330505;
NORTE GOIANO IMAGENS DIAGNOSTICAS LTDA;CLINICA NINA SUL;0;AVENIDA SANTANA;SETOR SUL I;URUACU;GO;Serra da Mesa;RADIOLOGIA E DIAGNÓSTICO POR IMAGEM;32323232;
NOSSA CLINICA SAUDE ACESSIVEL E HUMANIZADA LTDA;NOSSA CLINICA SAUDE ACESSIVEL;1097;AVENIDA MÁRIO YPIRANGA;ADRIANÓPOLIS;MANAUS;AM;Entorno de Manaus;RADIOLOGIA E DIAGNÓSTICO POR IMAGEM / GINECOLOGIA E OBSTETRICIA  / CARDIOLOGIA;;
NOVA ANESTESIA LTDA;NOVA ANESTESIA LTDA;317;AVENIDA SETE DE SETEMBRO;ICARAÍ;NITEROI;RJ;Metropolitana II;ANESTESIOLOGIA;24862747;
NOVA MEDICAL CENTER LTDA;NOVA MEDICAL CENTER;333;AVENIDA ROLF WIEST;BOM RETIRO;JOINVILLE;SC;Joinville;REUMATOLOGIA  / UROLOGIA  / GINECOLOGIA E OBSTETRICIA  / CIRURGIA GERAL  / PEDIATRIA  / OFTALMOLOGIA  / RADIOLOGIA E DIAGNÓSTICO POR IMAGEM / HEMATOLOGIA E HEMOTERAPIA / NEUROLOGIA  / PSICOLOGIA  / CARDIOLOGIA  / ENDOCRINOLOGIA E METABOLOGIA / INFECTOLOGIA  / CLÍNICA MÉDICA / HOMEOPATIA  / DERMATOLOGIA   / CIRURGIA VASCULAR / CIRURGIA ONCOLÓGICA;38423978;
NOVA SAUDE MARABA LTDA;INFINITA SAUDE MARABA;0;QUADRA SETE;NOVA MARABA;MARABA;PA;Itacaiúnas Tocantins;RADIOLOGIA E DIAGNÓSTICO POR IMAGEM;33212749;
NUCLEO DE MICROCIRURGIA OCULAR LTDA;NUCLEO DE MICROCIRURGIA;324;RUA RIO DE JANEIRO;CENTRO;DIVINOPOLIS;MG;Divinópolis;OFTALMOLOGIA;32224222;
NUCLEO DE UROLOGIA LAVRAS LTDA;NUCLEO DE UROLOGIA LAVRAS LTDA;352;RUA MISSENO DE PÁDUA;CENTRO;LAVRAS;MG;Varginha;UROLOGIA;;
NUCLEO MULTIDISCIPLINAR ECCELLENZA LTDA;NUCLEO MULTIDISCIPLINAR ECCELENZA;290;R ITALIA;NACOES;BALNEARIO CAMBORIU;SC;Balneário Camboriú;PSICOLOGIA  / NUTRICAO / TERAPIA OCUPACIONAL / FONOAUDIOLOGIA;32281480;
NUCLEO PSICOLOGICO INTEGRAR LTDA;NUCLEO PSICOLOGICO INTEGRAR;85;RUA DOUTOR ONOFRE;CENTRO;TEOFILO OTONI;MG;Teófilo Otoni;PSICOLOGIA  / FONOAUDIOLOGIA;;
NUNCHI INTERVENCOES COMPORTAMENTAIS PARA NEURODIVERGENTES LTDA;NUNCHI - INTERVENCOES COMPORTAMENTAIS PARA NEURODI;156;RUA GUSTAVO BARROSO;JARDIM SHANGRI-LA A;LONDRINA;PR;Londrina;PSICOLOGIA;;
NUTRIMED - CENTRO DE MEDICINA NUTRICIONAL;NUTRIMED;0;SGAS 613;ASA SUL;BRASILIA;DF;Distrito Federal;GERIATRIA   / CLÍNICA MÉDICA / NUTROLOGIA;33466000;
OFTALMO CENTER FRANCA LTDA;HOSPITAL OFTALMOLOGICO DE FRANCA;1713;RUA DOUTOR ANTÔNIO RICARDO PINHO;VILA CHAMPAGNAT;FRANCA;SP;Franca;OFTALMOLOGIA;37210823;
OFTALMO LASER CLINICA DE CIRURGIA E DIAGNOSTICOS OFTALMOLO;OFTALMO LASER;220;AVENIDA DIAS BARROSO;CENTRO;BATAGUASSU;MS;NCT de Três Lagoas;OFTALMOLOGIA;35411385;
OFTALMOCLINICA OLIVEIRA RIBEIRO LTDA;OFTALMOCLINICA COSTA RIBEIRO;885;RUA JUCELINO BARBOSA;CENTRO;ALFENAS;MG;Alfenas;OTORRINOLARINGOLOGIA  / OFTALMOLOGIA;32911679;
OFTALMOLOGIA DUMARESQ LTDA;OFTALMOLOGIA DUMARESQ;3700;AVENIDA AMINTAS BARROS;LAGOA NOVA;NATAL;RN;Grande Natal;OFTALMOLOGIA;32318001;
OIT CLINICA MEDICA LTDA;CLINICA OITAVA ROSADO;1104;SENADOR JOAO CAMARA;CENTRO;ACU;RN;II ETAM;CLÍNICA MÉDICA / GINECOLOGIA E OBSTETRICIA  / UROLOGIA  / CARDIOLOGIA;33156900;
ON MOVE PILATES E FISIOTERAPIA LTDA;ON MOVE PILATES E FISIOTERAPIA;792;AVENIDA ANTÔNIO RAMINELLI;PARQUE RESIDENCIAL ANA ROSA;CAMBE;PR;Londrina;FISIOTERAPIA;;
ONCOBIO SERVICOS DE SAUDE S A;ONCOCLINICAS CPO PARAIBA;183;AVENIDA MATO GROSSO;ESTADOS;JOAO PESSOA;PB;I Núcleo Regional de Saúde;ONCOLOGIA CLÍNICA / HEMATOLOGIA E HEMOTERAPIA / CIRURGIA ONCOLÓGICA;30152525;30152504
ONCOCLINICAS DO BRASIL SERVICOS MEDICOS S A;AIO INSTITUTO DE CANCER MATRIZ;9;QS 3  EPCT LOTES 3 5 7 E 9;AREAL (ÁGUAS CLARAS);BRASILIA;DF;Distrito Federal;REUMATOLOGIA  / CIRURGIA GERAL  / CIRURGIA TORACICA  / INFECTOLOGIA  / UROLOGIA  / HEMATOLOGIA E HEMOTERAPIA / CIRURGIA ONCOLÓGICA / COLOPROCTOLOGIA / PSICOLOGIA  / GINECOLOGIA E OBSTETRICIA  / RADIOTERAPIA  / ONCOLOGIA CLÍNICA / MASTOLOGIA  / GERIATRIA   / CIRURGIA DO APARELHO DIGESTIVO / NUTRICAO / GENETICA MÉDICA;;
ONCOCLINICAS DO BRASIL SERVICOS MEDICOS S A;ONCOCLINICAS CETTRO MATRIZ;10;SETOR SMHN D 02 BL A Nº 10 CONS. 1201 A 121214 - A;ASA NORTE;BRASILIA;DF;Distrito Federal;GENETICA MÉDICA / HEMATOLOGIA E HEMOTERAPIA / GINECOLOGIA E OBSTETRICIA  / CIRURGIA DO APARELHO DIGESTIVO / PSICOLOGIA  / CIRURGIA GERAL  / RADIOTERAPIA  / ONCOLOGIA CLÍNICA / MASTOLOGIA  / CIRURGIA PLÁSTICA / ENFERMAGEM  / NUTRICAO / CIRURGIA ONCOLÓGICA;30276200;
ONCOCLINICAS DO BRASIL SERVICOS MEDICOS S A;ONCOCLINICAS CETTRO MATRIZ;1;SHLS CONJUNTO A;ASA SUL;BRASILIA;DF;Distrito Federal;GENETICA MÉDICA / HEMATOLOGIA E HEMOTERAPIA / GINECOLOGIA E OBSTETRICIA  / CIRURGIA DO APARELHO DIGESTIVO / PSICOLOGIA  / CIRURGIA GERAL  / RADIOTERAPIA  / ONCOLOGIA CLÍNICA / MASTOLOGIA  / CIRURGIA PLÁSTICA / ENFERMAGEM  / NUTRICAO / CIRURGIA ONCOLÓGICA;30276200;
ONCOCLINICAS DO BRASIL SERVICOS MEDICOS S A;ONCOCLINICAS DO BRASIL SERVICOS MEDICOS AGIO BH;330;RUA PARAÍBA;FUNCIONÁRIOS;BELO HORIZONTE;MG;Belo Horizonte;ONCOLOGIA CLÍNICA / HEMATOLOGIA E HEMOTERAPIA;33088000;
ONCOLIFE SERVICOS MEDICOS LTDA;ONCOLIFE;603;RUA DUQUE DE CAXIAS;PRATA;CAMPINA GRANDE;PB;III Núcleo Regional de Saúde;CIRURGIA ONCOLÓGICA;30152500;
ORDC SERVICOS DE SAUDE SS LTDA;PULSE CENTRO CARDIOLOGICO;44;TRAVESSA CASTRO ALVES;CENTRO;FORTALEZA;CE;Fortaleza;CARDIOLOGIA;34542157;34542136
ORIGAMI TERAPIAS MULTIDISCIPLINARES;ORIGAMI TERAPIAS MULTIDISCIPLINARES LTDA;29;RUA NATALICIO LINS MADEIROS;BARRO DURO;MACEIO;AL;Região 01;FONOAUDIOLOGIA  / PSICOLOGIA  / TERAPIA OCUPACIONAL / FISIOTERAPIA;;
ORTHOS SERVICOS EM ORTOPEDIA LTDA;ORTHOS SERVICOS EM ORTOPEDIA LTDA;422;AVENIDA DA INTEGRAÇÃO AYRTON SENNA;SÃO JOSÉ;PETROLINA;PE;Petrolina;ORTOPEDIA E TRAUMATOLOGIA;;
ORTOCLIN CLINICA DE ORTOPEDIA E TRAUMATOLOGIA LTDA;ORTOCLIN;739;RUA ALAGOAS;CENTRO;IMPERATRIZ;MA;Tocantins;ORTOPEDIA E TRAUMATOLOGIA  / FISIOTERAPIA / NUTRICAO / REUMATOLOGIA;35257259;
ORTOFAZ CLINICA DE ORTOPEDIA E FRATURAS FAZENDA LTDA;ORTOFAZ CLINICA DE ORTOPEDIA E FRATURAS FAZENDA;190;AVENIDA DAS ARAUCÁRIAS;EUCALIPTOS;FAZENDA RIO GRANDE;PR;Metropolitana;CLÍNICA MÉDICA / NUTRICAO / ORTOPEDIA E TRAUMATOLOGIA;;
ORTOFISIO CLINICA DE ORTOPEDIA E FISIOTERAPIA ALMENARA LTDA;ORTOFISIO;455;SEVERIANO COUTINHO;CENTRO;ALMENARA;MG;Pedra Azul;ORTOPEDIA E TRAUMATOLOGIA  / FISIOTERAPIA;37211266;
OSTERMANN MEDICAL CENTER GAROPABA LTDA;OSTERMANN MEDICAL CENTER GAROPABA LTDA;388;PROFESSOR ANTONIO JOSE BOLTELHO;CENTRO;GAROPABA;SC;Grande Florianópolis;PEDIATRIA;32544261;
OTOCENTER FELIX SERVICOS DE SAUDE LTDA;OTOCENTER FELLIX SERVICOS DE SAUDE LTDA;229;ATOR PAULO GUSTAVO;ICARAÍ;NITEROI;RJ;Metropolitana II;OTORRINOLARINGOLOGIA;27106220;26100864
OTORRINO CLINICA E CIRURGIA LTDA;OTORRINO CLINICA E CIRURGIA;323;RUA DOUTOR ANTÔNIO DOS SANTOS CORAGEM;CENTRO;GUAXUPE;MG;Alfenas;OTORRINOLARINGOLOGIA;;
P P DA SILVA INTEGRAR;CLINICA INTEGRAR II DE ARAGUAINA;19;RUA DAS CAMÉLIAS;SETOR RODOVIÁRIO;ARAGUAINA;TO;Região de Saúde Médio Norte;FISIOTERAPIA / FONOAUDIOLOGIA  / TERAPIA OCUPACIONAL / PSICOLOGIA;;
P P S LTDA;CLINICA INTEGRAR DE TOCANTINOPOLIS;705;15 DE NOVEMBRO;CENTRO;TOCANTINOPOLIS;TO;Região de Saúde Portal do Bico;FONOAUDIOLOGIA  / PSICOLOGIA  / FISIOTERAPIA / TERAPIA OCUPACIONAL;;
PACO NUCLEO DE TREINAMENTO INTEGRAL LTDA;PACO NUCLEO DE TREINAMENTO INTEGRAL;620;RUA DAS ORQUÍDEAS;JARDIM CUIABÁ;CUIABA;MT;Baixada Cuiabana;FISIOTERAPIA / PSICOLOGIA  / TERAPIA OCUPACIONAL;;
PACTO MEDICINA E SEGURANCA DO TRABALHO LTDA.;PACTO MEDICINA E SEGURANCA DO TRABALHO LTDA.;274;RUA ANA DE OLIVEIRA;CENTRO;PATOS DE MINAS;MG;Patos de Minas;MEDICINA DO TRABALHO;30301346;
PATRICIA MARTINS PAGIOLI;;555;RUA JOSÉ BIANCHI;NOVA RIBEIRÂNIA;RIBEIRAO PRETO;SP;Ribeirão Preto;NUTRICAO;;
PATRICIA VIEIRA STUDIO DE PILATES LTDA;PATRICIA VIEIRA STUDIO DE PILATES;1661;RUA BOLÍVIA;LUTHER KING;FRANCISCO BELTRAO;PR;Francisco Beltrão;FISIOTERAPIA;;
PAULO KUHN PSICOLOGIA LTDA;PAULO KUHN PSICOLOGIA;215;RUA AGAPITO LEMOS;PARQUE SÃO JUDAS TADEU;PRESIDENTE PRUDENTE;SP;Presidente Prudente;PSICOLOGIA;;
PCS SERVICOS MEDICOS LTDA;PCS SERVICOS MEDICOS;1065;RUA PRESIDENTE VARGAS;VILA PROGRESSO;DOURADOS;MS;NCT de Dourados;PSIQUIATRIA;;
