NO_PRESTADOR;FANTASIA;NUMERO;LOGRADOURO;BAIRRO;MUNICIPIO;UF;REGIAO_SAUDE;ESPECIALIDADES;TELEFONE1;TELEFONE2
HOSPITAL NURSING CARE LTDA;HOSPITAL NURSING CARE;1583;AVENIDA DOUTOR ARTUR BERNARDES;PARQUE ROSÁRIO;CAMPOS DOS GOYTACAZES;RJ;Norte;FISIOTERAPIA / PNEUMOLOGIA  / ANESTESIOLOGIA  / UROLOGIA  / RADIOLOGIA E DIAGNÓSTICO POR IMAGEM / FONOAUDIOLOGIA  / GASTROENTEROLOGIA  / ORTOPEDIA E TRAUMATOLOGIA;37041330; 2
OUVIRCLIN FOZ COMERCIO E SERVICOS LTDA;OUVIRCLIN FONOAUDIOLOGIA;289;AVENIDA JUSCELINO KUBITSCHEK;CENTRO;FOZ DO IGUACU;PR;Foz do Iguaçu;FONOAUDIOLOGIA;;
VIRTUOS PSICOLOGIA E GESTAO LTDA;VIRTUOS PSICOLOGIA E GESTAO;1173;RUA PAISSANDU;CENTRO;PASSO FUNDO;RS;CRS 06 Passo Fundo;PSICOLOGIA;;
A R DA SILVA ATIVIDADES DE PSICOLOGIA E TERAPIA LTDA;ESPACO TERAPEUTICO ALINE RODRIGUES;152;RUA SILVA CARDOSO;BANGU;RIO DE JANEIRO;RJ;Metropolitana I;FONOAUDIOLOGIA  / NUTRICAO / PSICOLOGIA;;
A R SPINETTI;A R SPINETTI;1263;AVENIDA PRESIDENTE MEDICI;CENTRO;PEDRA PRETA;MT;Rondonópolis;OFTALMOLOGIA;;
A R SPINETTI;A R SPINETTI;1457;AVENIDA LAILA ZAHRAN;VILA AURORA II;RONDONOPOLIS;MT;Rondonópolis;OFTALMOLOGIA;;
A V TEOLOGIDES E CIA LTDA;CEOOC;4825;RUA NICANOR DOS SANTOS SILVA;ZONA I;UMUARAMA;PR;Umuarama;ORTOPEDIA E TRAUMATOLOGIA  / ANESTESIOLOGIA;30553172;
A. R. DE V. PESSOA PONTES;;101;RUA MANOEL ESTEVÃO;CENTRO;TIANGUA;CE;Tianguá;FISIOTERAPIA;;
ABA INTERVENCOES CLINICA DE TERAPIAS INTEGRADAS LTDA;ABA INTERVENCOES CLINICA DE TERAPIAS INTEGRADAS;618;AFRANIO RODRIGUES DA CUNHA;TABAJARAS;UBERLANDIA;MG;Uberlândia;FISIOTERAPIA / PSICOLOGIA  / FONOAUDIOLOGIA  / TERAPIA OCUPACIONAL / NUTRICAO;;32315820
ABC CLINICA DE PSICOLOGIA LTDA;PHILLUS CENTRO DE ESPECIALIDADES;216;RUA RIO GRANDE DO SUL;ORFÃS;PONTA GROSSA;PR;Ponta Grossa;NUTRICAO / PSICOLOGIA;;
ABRACCE ESPACO TERAPEUTICO LTDA;ABRACCE ESPACO TERAPEUTICO;933;RUA JOAQUIM ALVES TAVEIRA;VILA AURORA;DOURADOS;MS;NCT de Dourados;FONOAUDIOLOGIA  / FISIOTERAPIA / PSICOLOGIA;;
ABRACE TERAPIAS ESPECIALIZADAS LTDA;BEATRIZ CORREA FONOAUDIOLOGIA;276;AVENIDA CORONEL JOSÉ SOARES MARCONDES;VILA MARISTELA;PRESIDENTE PRUDENTE;SP;Presidente Prudente;FONOAUDIOLOGIA  / TERAPIA OCUPACIONAL / ASSISTENCIA A PESSOAS PORTADORAS DE DEFICIENCIAS  / PSICOLOGIA  / FISIOTERAPIA;;
AC CLINICA E NEFROLOGIA LTDA;AC CLINICA E NEFROLOGIA;241;PADRE ALMIR NEVES DE MEDEIROS;SOBRADINHO;PATOS DE MINAS;MG;Patos de Minas;NEFROLOGIA;;
ACCEPT SAUDE CARUARU LTDA;ACCEPT CARUARU;800;AVENIDA ADJAR DA SILVA CASÉ;INDIANÓPOLIS;CARUARU;PE;Caruaru;PSICOLOGIA;;
ACCEPT SAUDE LTDA;ACCEPT SAUDE;153;AVENIDA GOVERNADOR AGAMENON MAGALHÃES;SANTO AMARO;RECIFE;PE;Recife;PSICOLOGIA;;
ACCEPT SAUDE PAULISTA LTDA;ACCEPT SAUDE PAULISTA;242;RODOVIA PE-15;CENTRO;PAULISTA;PE;Recife;PSICOLOGIA;;
ACMV MEDICOS ASSOCIADOS SOCIEDADE SIMPLES LTDA;Instituto Crescer Bem;611;SAO JOAQUIM;CENTRO;SAO LEOPOLDO;RS;CRS 01 Porto Alegre;GASTROENTEROLOGIA  / NUTRICAO / PNEUMOLOGIA  / PEDIATRIA;35091694;
ACMV MEDICOS ASSOCIADOS SOCIEDADE SIMPLES LTDA;Instituto Crescer Bem;66;RUA GONÇALVES DIAS;CENTRO;CANOAS;RS;CRS 01 Porto Alegre;GASTROENTEROLOGIA  / NUTRICAO / PNEUMOLOGIA  / PEDIATRIA;35944033;
ACOLHER CLINICA DE PSICOLOGIA E ATENDIMENTOS MULTIPROFISSION;ACOLHER CLINICA DE PSICOLOGIA;203;RUA EDUARDO SANTOS PEREIRA;CENTRO;CAMPO GRANDE;MS;NCT de Campo Grande;PSICOLOGIA;;
ACOLHER KIDS FISIOTERAPIA E TERAPIAS INTEGRATIVAS LTDA;ACOLHER KIDS FISIOTERAPIA E TERAPIAS INTEGRATIVAS;1149;RUA FELISBERTO CARRIJO;TABAJARA;UBERLANDIA;MG;Uberlândia;FISIOTERAPIA / FONOAUDIOLOGIA;;
ADA OLIVEIRA DE CARVALHO MARQUES E CIA LTDA;CLINICA ADA CARVALHO;212;AVENIDA JATOBÁ;CENTRO;SANTA CRUZ DO CAPIBARIBE;PE;Caruaru;TERAPIA OCUPACIONAL / FISIOTERAPIA / PSICOLOGIA  / ASSISTENCIA A PESSOAS PORTADORAS DE DEFICIENCIAS  / PEDIATRIA  / FONOAUDIOLOGIA;;
ADAUTO DE SOUZA GUERRA JUNIOR;ADAUTO GUERRA JR;50;AV OLIMPIO WANDERLY;CENTRO;TRIUNFO;PE;Serra Talhada;FISIOTERAPIA;;
ADRIANA DE NAZARE MIZIARA;ADRIANA DE NAZARE MIZIARA;788;RUA DA CONSTITUIÇÃO;ABADIA;UBERABA;MG;Uberaba;CARDIOLOGIA;33326802;33323506
ADRIANO VASCONCELOS CUNHA;ADRIANO VASCONCELOS CUNHA;323;RUA 83;SETOR SUL;GOIANIA;GO;Central;PSICOLOGIA;;
AF SAUDE LTDA;VIVABEM SAUDE;9012;ESTRADA DE ALDEIA;VERA CRUZ;CAMARAGIBE;PE;Recife;PSICOLOGIA  / NUTRICAO / FISIOTERAPIA;;
AFETIVAMENTE CLINICA INFANTOJUVENIL LTDA;AFETIVAMENTE CLINICA INFANTOJUVENIL;195;RUA GUILHERME JOÃO FABRIN;NOSSA SENHORA DE LOURDES;SANTA MARIA;RS;CRS 04 Santa Maria;FONOAUDIOLOGIA  / NUTRICAO / PSIQUIATRIA  / TERAPIA OCUPACIONAL / PSICOLOGIA;;
AFETO ESPACO TERAPEUTICO LTDA;AFETO ESPACO TERAPEUTICO;71;RUA BARÃO JOSÉ MIGUEL;FAROL;MACEIO;AL;Região 01;FISIOTERAPIA / FONOAUDIOLOGIA  / TERAPIA OCUPACIONAL / PSICOLOGIA;;
AFETO KIDS CLINICA ESPECIALIZADA LTDA;AFETO KIDS CLINICA ESPECIALIZADA;462;RUA FRANCISCO SEGUNDO DA COSTA;COMBATE;QUIXADA;CE;Quixadá;FONOAUDIOLOGIA  / TERAPIA OCUPACIONAL / NUTRICAO / PSICOLOGIA;;
AFETTO CENTRO DE ATENDIMENTO E SERVICOS EM PSICOLOGIA LTDA;AFETTO CENTRO DE ATENDIMENTO E SERVICOS EM PSICOLO;123;RUA TANGARÁ;VILA RICA;CAMPO GRANDE;MS;NCT de Campo Grande;PSICOLOGIA;;
AGE FISIOTERAPIA E ESTETICA LTDA;AGE FISIOTERAPIA E ESTETICA LTDA;2380;RUA PINHEIRO MACHADO;CENTRO;SANTA MARIA;RS;CRS 04 Santa Maria;FISIOTERAPIA / TERAPIA OCUPACIONAL;32171853;
AGUILAR ELETRO NEUROLOGIA LTDA;CLINICA NEUROSOLUTION;145;EUCLIDES MIRAGAIA;CENTRO;SAO JOSE DOS CAMPOS;SP;Taubaté;NEUROLOGIA  / NEUROCIRURGIA;39229822;
AILANA VIEIRA MACHADO DE SANTANNA;;50;LARGO SÃO CRISTOVÃO;SÃO CRISTÓVÃO;PALMEIRA DOS INDIOS;AL;Região 04;PSICOLOGIA;;
AIRES RAMON DOS REIS PSICOLOGO CLINICO;AIRES RAMON DOS REIS PSICOLOGO CLINICO;415;AVENIDA VICENTE ZINNI;VILA NOVA;PORTO FERREIRA;SP;Araraquara;PSICOLOGIA;;
ALBERTINA RAMOS NUTRICIONISTA LTDA;ALBERTINA RAMOS NUTRICIONISTA;345;RUA OCTAVIANO TEIXEIRA DOS SANTOS;CENTRO;FRANCISCO BELTRAO;PR;Francisco Beltrão;NUTRICAO;;
ALBINO MACHADO LTDA;SEMEAR INSTITUTO MULTIPROFISSIONAL;1708;AVENIDA SÍLVIO AMÉRICO SASDELLI;ITAIPU A;FOZ DO IGUACU;PR;Foz do Iguaçu;FONOAUDIOLOGIA  / PSICOLOGIA  / TERAPIA OCUPACIONAL;;
ALDO MEDEIROS DOS SANTOS;ALDO MEDEIROS DOS SANTOS;205;RUA DOUTOR PEDRO FIRMINO;CENTRO;PATOS;PB;VI Núcleo Regional de Saúde;MEDICINA FISICA E REABILITACAO  / FISIOTERAPIA / REUMATOLOGIA;34213406;
ALEXANDRE MERCADANTE REABILITACOES LTDA;ALEXANDRE MERCADANTE REABILITACOES LTDA;55;RUA PRUDENTE DE MORAES;CENTRO;JACAREI;SP;Taubaté;FISIOTERAPIA;39612301;
ALICE MONTEIRO SERVICOS MEDICOS LTDA;ALICE MONTEIRO SERVICOS MEDICOS LTDA;1207;RUA JOSÉ DE ALENCAR;NOSSA SENHORA DA ABADIA;UBERABA;MG;Uberaba;DERMATOLOGIA;33330977;
ALJ SERVICOS EM SAUDE LTDA;ACESSO SAUDE;955;GABRIEL DE LARA;LEBLON;PARANAGUA;PR;Paranaguá;CLÍNICA MÉDICA / CARDIOLOGIA  / NUTRICAO;30381310;
ALMEIDA BORGES SOUSA LTDA;LIVER INSTITUTO DO FIGADO DE GOIAS;1148;AVENIDA PORTUGAL;SETOR MARISTA;GOIANIA;GO;Central;GERIATRIA   / GASTROENTEROLOGIA;31578548;
ALPI MARQUES CLINICA MEDICA E MULTIDISCIPLINAR;ALPI MARQUES CLINICA MEDICA E MULTIDISCIPLINAR FIL;99;ESTRADA DO PORTELA, 99;MADUREIRA;RIO DE JANEIRO;RJ;Metropolitana I;FONOAUDIOLOGIA  / TERAPIA OCUPACIONAL / PSICOLOGIA  / PSIQUIATRIA;32177889;
ALPI MARQUES CLINICA MEDICA E MULTIDISCIPLINAR LTDA;ALPI  MARQUES CLiNICA MeDICA E MULTIDISCIPLINAR;2445;AVENIDA MERITI;VILA DA PENHA;RIO DE JANEIRO;RJ;Metropolitana I;TERAPIA OCUPACIONAL / FONOAUDIOLOGIA  / PSICOLOGIA  / PSIQUIATRIA;;
ALVEOLAR GRUPO DE FISIOTERAPIA LTDA;ALVEOLAR GRUPO DE FISIOTERAPIA LTDA;480;RUA DA PAISAGEM;VILA DA SERRA;NOVA LIMA;MG;Belo Horizonte;FISIOTERAPIA;32288107;
ALVES E BORDINHON LTDA;LABCLIN;107;RUA MAJOR VIEIRA;CENTRO;CATAGUASES;MG;Leopoldina;PATOLOGIA CLINICA / MEDICINA LABORATORIAL;34219210;
AMANDA A ALVES;PNEUMO VIDA;1536;MÁRIO MENDES DE ALBUQUERQUE;JARDIM ESMERALDA;RONDONOPOLIS;MT;Rondonópolis;PNEUMOLOGIA;;
AMANDA BISSACOTTI BONILLA LTDA;AMANDA BISSACOTTI BONILLA;816;JOAO CANDIDO CAMARA;JARDIM AMERICA;DOURADOS;MS;NCT de Dourados;PSICOLOGIA;;
AMANDA PEREIRA RODRIGUES COSTA;AMANDA PEREIRA RODRIGUES COSTA;5723;AVENIDA AFONSO PENA;CHÁCARA CACHOEIRA;CAMPO GRANDE;MS;NCT de Campo Grande;DERMATOLOGIA;30454800;
AMAR SAUDE INTEGRATIVA LTDA;AMAR SAUDE INTEGRATIVA LTDA;2048;RUA BENTO GONÇALVES;CENTRO;CAXIAS DO SUL;RS;CRS 05 Caxias do Sul;HOMEOPATIA  / FISIOTERAPIA;;
AMCAD ASSISTENCIA MEDICA A CRIANCA E AO ADOLESCENTE S/S;AMCAD;395;AVENIDA PRINCESA ISABEL;SÃO CAETANO;ITABUNA;BA;Itabuna;PEDIATRIA;36178096;
AME - ESPACO DE ATENDIMENTO MULTIPROFISSIONAL ESPECIALIZADO - LTDA;INTEGRAR CLINICA INTERDISCIPLINAR;593;RUA IBIRAPUERA;RENATO GONÇALVES;BARREIRAS;BA;Barreiras;PSICOLOGIA  / TERAPIA OCUPACIONAL / ASSISTENCIA A PESSOAS PORTADORAS DE DEFICIENCIAS  / FONOAUDIOLOGIA;36118445;
AME ASSISTENCIA MULTIDISCIPLINAR EM ENDOMETRIOSE LTDA;AME ASSISTENCIA MULTIDISCIPLINAR EM ENDOMETRIOSE L;850;AVENIDA JOÃO CABRAL DE MELLO NETO;BARRA DA TIJUCA;RIO DE JANEIRO;RJ;Metropolitana I;COLOPROCTOLOGIA / UROLOGIA  / GINECOLOGIA E OBSTETRICIA;31519694;
AME CONSULTA MEDICA ESPECIALIZADA LTDA;AME CONSULTA;2150;RUA HEITOR LIBERATO;SÃO JOÃO;ITAJAI;SC;Itajaí;ORTOPEDIA E TRAUMATOLOGIA  / PSICOLOGIA  / PSIQUIATRIA  / GASTROENTEROLOGIA  / GINECOLOGIA E OBSTETRICIA  / MASTOLOGIA  / OTORRINOLARINGOLOGIA  / HEMATOLOGIA E HEMOTERAPIA / PEDIATRIA  / CARDIOLOGIA  / OFTALMOLOGIA  / RADIOLOGIA E DIAGNÓSTICO POR IMAGEM / ALERGIA E IMUNOLOGIA;33114778;
AMERICO FALCAO SERVICOS MEDICOS LTDA;CLINICA CRESCER;556;R ALVARO AUGUSTO;GINASIO;SERRINHA;BA;Serrinha;PEDIATRIA  / OTORRINOLARINGOLOGIA  / NUTRICAO / PSICOLOGIA  / FONOAUDIOLOGIA  / PSIQUIATRIA;;
AMGARTEN E GOMES CLINICA DE ESPECIALIDADES LTDA;AMGARTEN E GOMES CLINICA DE ESPECIALIDADES LTDA;0;ACSU SO 40 AVENIDA LO 11;PLANO DIRETOR SUL;PALMAS;TO;Região de Saúde do Capim Dourado;GERIATRIA   / ENDOCRINOLOGIA E METABOLOGIA;33222442;
AMMARE PSICOLOGIA LTDA;ADRIANA LOPES;130;RUA LAURO NUNES DE OLIVEIRA;SANTA DOROTÉIA;POUSO ALEGRE;MG;Pouso Alegre;PSICOLOGIA;;
AMORADAR SAUDE ESPECIALIZADA LTDA;;188;RUA PADRE ANCHIETA;CENTRO;BARBACENA;MG;Barbacena;PSIQUIATRIA;;
AMPLIAR NUCLEO DE PSICOLOGIA APLICADA LTDA;AMPLIAR NUCLEO DE PSICOLOGIA APLICADA LTDA;40;RUA JORGE MATTAR;CENTRO;TEOFILO OTONI;MG;Teófilo Otoni;TERAPIA OCUPACIONAL / PSICOLOGIA  / FONOAUDIOLOGIA;35232750;
ANA CAROLINA DEMARCO ROLDAN;NIP NUCLEO DE INTERVENCAO PRECOCE;621;RUA SANTOS DUMONT;CENTRO;PELOTAS;RS;CRS 03 Pelotas;PSICOLOGIA  / TERAPIA OCUPACIONAL / FONOAUDIOLOGIA  / FISIOTERAPIA;32214716;
ANA CAROLINE RAMIRES RAMOS EIRELI;ANA CAROLINE RAMIRES RAMOS EIRELI;15;AVENIDA JOÃO CERNACH;JARDIM NOSSA SENHORA DE FÁTIMA;BIRIGUI;SP;Araçatuba;OFTALMOLOGIA;36442005;
ANA CLARA LIMA PORTELA SILVA;ESPACO DESENVOLVER CLINICA MULTIPROFISSIONAL;599;RUA AGAPITO DOS SANTOS;CENTRO;ARACATI;CE;Aracati;FONOAUDIOLOGIA  / TERAPIA OCUPACIONAL / NUTRICAO / ASSISTENCIA A PESSOAS PORTADORAS DE DEFICIENCIAS  / MÉDICO GENERALISTA / PSICOLOGIA;;
ANA CRISTINA DE CARVALHO PAIVA;;478;RUA TEIXEIRA DE FREITAS;SANTO ANTÔNIO;BELO HORIZONTE;MG;Belo Horizonte;PSICOLOGIA;;
ANA LIVIA TIAGO MURAD;ANA LIVIA TIAGO MURAD;59;RUA JOAQUIM PEIXOTO RAMOS;CENTRO;CATAGUASES;MG;Leopoldina;GINECOLOGIA E OBSTETRICIA;34218528;
ANA LUIZA FELIPE ROCHA;EVOLUIR CONSULTORIO TERAPEUTICO;205;PREFEITO RAIMUNDO ROCHA;CENTRO;ACARAU;CE;Acaraú;TERAPIA OCUPACIONAL / PSICOLOGIA  / FONOAUDIOLOGIA  / FISIOTERAPIA;;
ANA LUIZA TRINDADE;;301;RUA GOMES JARDIM;SANTANA;PORTO ALEGRE;RS;CRS 01 Porto Alegre;MEDICINA FISICA E REABILITACAO;25007200;
ANA PAULA MORAES DE OLIVEIRA;ANA PAULA MORAES DE OLIVEIRA;717;AVENIDA MONSENHOR SCALABRINI;CENTRO;GUAPORE;RS;CRS 05 Caxias do Sul;PSICOLOGIA;;
ANATOCENTER DIAGNOSTICO MEDICOS LTDA;ANATOCENTER DIAGNOSTICOS;2355;RUA JOSÉ BONIFÁCIO;CENTRO;SANTA MARIA;RS;CRS 04 Santa Maria;PATOLOGIA CLINICA / MEDICINA LABORATORIAL / PATOLOGIA;33478997;
ANDERSON FERNANDES NEUROPSICOLOGIA E SAUDE MENTAL LTDA;ANDERSON FERNANDES NEUROPSICOLOGIA E SAUDE MENTAL;24;RUA REPÚBLICA DO PERU;NOVA BETÂNIA;MOSSORO;RN;II ETAM;PSICOLOGIA;30872200;
ANDRADE MIRA SERVICOS MEDICOS LTDA;ANDRADE MIRA SERVICOS MEDICOS LTDA;1549;RUA GENERAL CARNEIRO;CENTRO;FRANCA;SP;Franca;ORTOPEDIA E TRAUMATOLOGIA  / GINECOLOGIA E OBSTETRICIA;;
ANDRE SILVA NOBREGA;ANDRE SILVA NOBREGA;5753;SANTOS DUMONT;PAPICU;FORTALEZA;CE;Fortaleza;GINECOLOGIA E OBSTETRICIA;;
ANDREA KOTZIAN PEREIRA;;55;RUA TENENTE-CORONEL FABRÍCIO PILAR;MONT SERRAT;PORTO ALEGRE;RS;CRS 01 Porto Alegre;PSICOLOGIA;;
ANDREIA LIMA DINIZ LTDA;ANDRÉIA LIMA DINIZ LTDA;939;RUA CORONEL CORNÉLIO SOARES;NOSSA SENHORA DA PENHA;SERRA TALHADA;PE;Serra Talhada;ACUPUNTURA;;
ANGELINA S ARAUJO ROCHA FONOAUDIOLOGIA;CLINICA AVANCE;435;TANCREDO NEVES;SAO JOAO;CRUZ;CE;Acaraú;NUTRICAO / FONOAUDIOLOGIA  / PSICOLOGIA  / ASSISTENCIA A PESSOAS PORTADORAS DE DEFICIENCIAS  / TERAPIA OCUPACIONAL;;
ANGELITA BRITES BECKER;;179;TRAV. AFONSO HOSTIN;SEIS DE MAIO;PALMEIRA DAS MISSOES;RS;CRS 15 Palmeira das Missões;PSICOLOGIA;;
ANGIOPED LTDA ME;ANGIOPED;100;RUA PEDRO VELHO;SANTO ANTÔNIO;MOSSORO;RN;II ETAM;CIRURGIA VASCULAR / ALERGIA E IMUNOLOGIA  / ANGIOLOGIA / PNEUMOLOGIA;33168012;
ANNA ANDREA DE GODOY PARE MENDES LTDA;INSTITUTO DE SAUDE VASCULAR ISV;364;AVENIDA FREI PAULINO;NOSSA SENHORA DA ABADIA;UBERABA;MG;Uberaba;CIRURGIA VASCULAR / CIRURGIA GERAL;;
ANNA JULIA RAMOS FONTANARI;ANNA JULIA R FONTANARI MEDICA PIRACICABA;109;PROFESSOR LUIZ CURIACOS;CIDADE JARDIM;PIRACICABA;SP;Piracicaba;ENDOCRINOLOGIA E METABOLOGIA;;
ANNY KAROLAINY SILVA DE LIMA;;;;;;;;FISIOTERAPIA;;
ANTONIO VICENTE AITA HAHN;CONSULTORIO MEDICO ANTONIO VICENTE AITA HAHN;1124;RUA MARECHAL FLORIANO PEIXOTO;CENTRO;SANTA MARIA;RS;CRS 04 Santa Maria;CARDIOLOGIA;32225801;
APRENDER PSICOLOGIA LTDA;INSTITUTO APRENDER;23;QUADRA ARSE 21 AVENIDA NS 2;PLANO DIRETOR SUL;PALMAS;TO;Região de Saúde do Capim Dourado;TERAPIA OCUPACIONAL / FONOAUDIOLOGIA  / PSICOLOGIA;;
AQUARELA MD LTDA;INSTITUTO NINAR;1080;R TAPUIAS;SETOR AEROPORTO;CRISTALINA;GO;Entorno Sul;PSICOLOGIA  / ASSISTENCIA A PESSOAS PORTADORAS DE DEFICIENCIAS  / TERAPIA OCUPACIONAL / FISIOTERAPIA / FONOAUDIOLOGIA;32323232;
ARACELI DOS SANTOS BRITO;ARACELI DOS SANTOS BRITO;1947;RUA MARECHAL DEODORO;CENTRO;PORTO VELHO;RO;Departamento de Epidemiologia;REUMATOLOGIA;;
ARAKI SANTOS OFTALMOLOGIA EIRELI;CLINICA DE OLHOS CINTHIA ARAKI;1690;AVENIDA DOUTOR LUIZ TEIXEIRA MENDES;ZONA 05;MARINGA;PR;Maringá;OFTALMOLOGIA;;
ARAUJO E GONCALVES LTDA;EXAMED DIAGNOSTICO POR IMAGEM;1805;NUMERIANO BEZERRA DE CASTRO;SETOR BELA VISTA 1;PEDRO AFONSO;TO;Região de Saúde Cultura do Cerrado;CLÍNICA MÉDICA / RADIOLOGIA E DIAGNÓSTICO POR IMAGEM;34661818;
ARAUJO SILVA CLINICA DE SERVICOS MEDICOS;MOMENTO MULHER;1325;RUA JOSÉ GOMES DOMINGUES;SANTA FÉ;CAMPO GRANDE;MS;NCT de Campo Grande;GINECOLOGIA E OBSTETRICIA  / RADIOLOGIA E DIAGNÓSTICO POR IMAGEM;33263796;
ARISTIDES CAVALCANTE SAUDE E ESTETICA LTDA;ARISTIDES CAVALCANTE SAUDE E ESTETICA LTDA;123;RUA PROFESSORA NADYR MAIA GOMES RÊGO;JATIÚCA;MACEIO;AL;Região 01;FONOAUDIOLOGIA  / PSICOLOGIA  / FISIOTERAPIA / TERAPIA OCUPACIONAL / CLÍNICA MÉDICA;;
ARISTOTELINA S. DE A. NETO LTDA;HEALTH INTEGRADA;14;RUA COPENHAGEM;PLANALTO;MANAUS;AM;Entorno de Manaus;FISIOTERAPIA / ASSISTENCIA A PESSOAS PORTADORAS DE DEFICIENCIAS  / FONOAUDIOLOGIA  / PSICOLOGIA;;
ARTRO CLINICA DE CIRURGIA ORTOPEDICA LTDA;ARTRO CLINICA ORTOPEDICA;2411;AVENIDA VICENTE MACHADO;CAMPINA DO SIQUEIRA;CURITIBA;PR;Metropolitana;ORTOPEDIA E TRAUMATOLOGIA;33405500;
ASA SERVICOS MEDICOS LTDA - ME;ASA SERVICOS MEDICOS;1333;RUA LUÍS DOMINGUES;CENTRO;IMPERATRIZ;MA;Tocantins;GERIATRIA;;
ASSIS CESAR SERVICOS MULTIDISCIPLINARES;HOPE ABA CIENCIA COMPORTAMENTAL;650;RUA ALBERTO MAXWEL;VILA ALBA;DOURADOS;MS;NCT de Dourados;FISIOTERAPIA / PSICOLOGIA  / TERAPIA OCUPACIONAL / FONOAUDIOLOGIA;;
ASSISTENCIA DERMATOLOGICA DRA CANDIDA ELENA DE REGINA E REGINA LTDA;ASSISTENCIA DERMATOLOGICA DRA CANDIDA ELENA DE REG;55;RUA GILDÁSIO AMADO;BARRA DA TIJUCA;RIO DE JANEIRO;RJ;Metropolitana I;DERMATOLOGIA   / PEDIATRIA;;
ASSISTENCIA DERMATOLOGICA DRA CANDIDA ELENA DE REGINA E REGINA LTDA;ASSISTENCIA DERMATOLOGICA DRA CANDIDA ELENA DE REG;550;RUA VISCONDE DE PIRAJÁ, 550;IPANEMA;RIO DE JANEIRO;RJ;Metropolitana I;DERMATOLOGIA   / PEDIATRIA;;
ASSO. QUIXADAENSE DE PROTECAO E ASS. A MATERNIDADE A INFANCIA E A ADOL;HOSPITAL E MATERNIDADE JESUS MARIA JOSE;2268;RUA FRANCISCO ALMEIDA PINHEIRO;PLANALTO UNIVERSITÁRIO;QUIXADA;CE;Quixadá;ANESTESIOLOGIA  / PEDIATRIA  / OFTALMOLOGIA  / GASTROENTEROLOGIA  / FISIOTERAPIA / MEDICINA FISICA E REABILITACAO  / RADIOLOGIA E DIAGNÓSTICO POR IMAGEM / PATOLOGIA CLINICA / MEDICINA LABORATORIAL / CLÍNICA MÉDICA / CARDIOLOGIA  / CIRURGIA GERAL  / GINECOLOGIA E OBSTETRICIA;34120681;
ASSOCIACAO CONGREGACAO DE SANTA CATARINA;HOSPITAL SANTA ISABEL;300;MARECHAL FLORIANO PEIXOTO;CENTRO;BLUMENAU;SC;Blumenau;NEUROCIRURGIA  / CIRURGIA VASCULAR / NEUROLOGIA  / MEDICINA NUCLEAR  / GASTROENTEROLOGIA  / OTORRINOLARINGOLOGIA  / INFECTOLOGIA  / CIRURGIA PEDIATRICA  / CIRURGIA DE CABEÇA E PESCOÇO / RADIOTERAPIA  / OFTALMOLOGIA  / ENDOCRINOLOGIA E METABOLOGIA / CIRURGIA TORACICA  / CIRURGIA GERAL  / CIRURGIA E TRAUMATOLOGIA BUCO-MAXILO-FACIAIS / UROLOGIA  / PNEUMOLOGIA  / DERMATOLOGIA   / GINECOLOGIA E OBSTETRICIA  / CIRURGIA CARDIOVASCULAR  / CLÍNICA MÉDICA / PEDIATRIA  / CIRURGIA PLÁSTICA / MASTOLOGIA  / NEFROLOGIA  / PSIQUIATRIA  / ANESTESIOLOGIA  / HEMATOLOGIA E HEMOTERAPIA / REUMATOLOGIA  / ORTOPEDIA E TRAUMATOLOGIA  / ANGIOLOGIA / COLOPROCTOLOGIA / GERIATRIA   / FISIOTERAPIA / MEDICINA FISICA E REABILITACAO  / ONCOLOGIA CLÍNICA / NUTRICAO / RADIOLOGIA E DIAGNÓSTICO POR IMAGEM / CIRURGIA ONCOLÓGICA / MEDICINA INTENSIVA / CIRURGIA DO APARELHO DIGESTIVO / CARDIOLOGIA  / PATOLOGIA CLINICA / MEDICINA LABORATORIAL;33211000;
ASSOCIACAO HOSPITALAR VILA NOVA;ASSOCIACAO HOSPITALAR VILA NOVA;676;COSMO FAVRETTO;CENTRO;SARANDI;RS;CRS 15 Palmeira das Missões;GINECOLOGIA E OBSTETRICIA  / NEFROLOGIA  / MASTOLOGIA  / PSICOLOGIA  / UROLOGIA  / RADIOTERAPIA  / CIRURGIA VASCULAR / HEMATOLOGIA E HEMOTERAPIA / PATOLOGIA CLINICA / MEDICINA LABORATORIAL / EVENTOS CLINICOS - ASSISTENCIA HOSPITALAR  / ACUPUNTURA  / PATOLOGIA / FISIOTERAPIA / CIRURGIA ONCOLÓGICA / NEUROLOGIA  / INFECTOLOGIA  / ENFERMAGEM  / REUMATOLOGIA  / ENDOCRINOLOGIA E METABOLOGIA / CIRURGIA GERAL  / ONCOLOGIA CLÍNICA / TERAPIA OCUPACIONAL / NEUROCIRURGIA  / CIRURGIA DO APARELHO DIGESTIVO / GENETICA MÉDICA / GASTROENTEROLOGIA  / CIRURGIA TORACICA  / ALERGIA E IMUNOLOGIA  / FONOAUDIOLOGIA  / HOMEOPATIA  / REMOCOES  / ORTOPEDIA E TRAUMATOLOGIA  / MEDICINA DO TRABALHO / OFTALMOLOGIA  / MEDICINA NUCLEAR  / ANGIOLOGIA / CIRURGIA DA MÃO / CLÍNICA MÉDICA / CARDIOLOGIA  / CIRURGIA CARDIOVASCULAR  / CIRURGIA PEDIATRICA  / GERIATRIA   / PNEUMOLOGIA  / MEDICINA FISICA E REABILITACAO  / MEDICINA DA FAMÍLIA E COMUNIDADE / ANESTESIOLOGIA  / PEDIATRIA  / OTORRINOLARINGOLOGIA  / CIRURGIA DE CABEÇA E PESCOÇO / RADIOLOGIA E DIAGNÓSTICO POR IMAGEM / NUTROLOGIA / COLOPROCTOLOGIA / PSIQUIATRIA;36115750;
ATMA COMUNICACAO PESSOAL LTDA;ATMA VOZ E COMUNICACAO;472;RUA NUNES MACHADO;REBOUÇAS;CURITIBA;PR;Metropolitana;FONOAUDIOLOGIA;;
ATTIVA PRESTACOES DE SERVICOS LTDA;ENDHOS MEDICINA INTEGRADA;877;RUA BARÃO DO RIO BRANCO;CENTRO;BOA VISTA;RR;Secretaria Estadual de Saúde;GASTROENTEROLOGIA  / CIRURGIA DO APARELHO DIGESTIVO / CIRURGIA ONCOLÓGICA / CIRURGIA GERAL  / CIRURGIA PEDIATRICA;32244453;
ATUAL SERVICOS MEDICOS LTDA EPP;ATUAL SERVICOS MEDICOS;1684;RUA FRANCISCO BARBOSA;CIDADE NOVA;FRANCA;SP;Franca;OFTALMOLOGIA;37233734;
AUDIOFONO LTDA;AUDIOFONO;75;RUA PEREGRINO FERRARI JÚNIOR;CENTRO;CASTRO;PR;Ponta Grossa;FONOAUDIOLOGIA;;
AUDIOPULSE LTDA;AUDIOPULSE;243;SANTA TEREZINHA;CENTRO;JOACABA;SC;Joaçaba;FONOAUDIOLOGIA;39522900;
AWMS SERVICOS MEDICOS LTDA;WMS SAUDE;1883;TEREZINHA LEITE;PENEDO;CAICO;RN;IV ETAM;DERMATOLOGIA;;
AYSU ATIVIDADES DE PSICOLOGIA E PSICANALISE;AYSU CLINICA PSICOLOGICA;1674;AVENIDA EPHIGÊNIO SALLES;ALEIXO;MANAUS;AM;Entorno de Manaus;PSICOLOGIA;;
AZZOUZ DERMATOLOGIA LTDA;AZZOUZ DERMATOLOGIA;2930;PRESIDENTE EPITÁCIO PESSOA;TAMBAUZINHO;JOAO PESSOA;PB;I Núcleo Regional de Saúde;DERMATOLOGIA;30218303;
B C CLINICA MULTIDISCIPLINAR LTDA;CLINICA MENTALIZE CUIDADOS EM SAUDE MENTAL;597;AVENIDA SENADOR FURTADO;NOVA PARNAÍBA;PARNAIBA;PI;TD Planície Litorânea;PSICOLOGIA  / FISIOTERAPIA / TERAPIA OCUPACIONAL / FONOAUDIOLOGIA  / MÉDICO GENERALISTA / PSIQUIATRIA  / ENDOCRINOLOGIA E METABOLOGIA;;
B CONDOLO TREINAMENTOS LTDA;PSICOLOGIA ABA EM ACAO;1111;AVENIDA BONIFÁCIO VILELA;CENTRO;PONTA GROSSA;PR;Ponta Grossa;NUTRICAO / FISIOTERAPIA / TERAPIA OCUPACIONAL / FONOAUDIOLOGIA  / PSICOLOGIA;;
B M MACEDO LTDA;APREENDER PSICOLOGIA;1160;AV CASTELO BRANCO;OESTE;PARAISO DO TOCANTINS;TO;Região de Saúde do Cantão;PSICOLOGIA;;
BANDEIRA CONSULTORIA EM MEDICINA LTDA;BANDEIRA CONSULTORIA;1883;AVENIDA SANTOS DUMONT;CENTRO;LAURO DE FREITAS;BA;Salvador;ACUPUNTURA  / INFECTOLOGIA;33797956;
BAOBA - NUCLEO DE DESENVOLVIMENTO INFANTIL LTDA;BAOBA - NUCLEO DE DESENVOLVIMENTO INFANTIL;;;;;;;PSICOLOGIA;;
BBJ SERVICOS MEDICOS LTDA;CLINICA PHD;240;AVENIDA GENTIL MESSIAS - KITATE;VILA CRUZ;POCOS DE CALDAS;MG;Pouso Alegre;REUMATOLOGIA  / DERMATOLOGIA   / HEMATOLOGIA E HEMOTERAPIA / PEDIATRIA;31141459;
BE ABA INTERVENCAO COMPORTAMENTAL LTDA;BE ABA INTERVENCAO COMPORTAMENTAL;901;TRAVESSA WE 72;CIDADE NOVA;ANANINDEUA;PA;Metropolitana;FISIOTERAPIA / PSICOLOGIA  / TERAPIA OCUPACIONAL / FONOAUDIOLOGIA  / NUTRICAO;;
BE.ABA: INTERVENCAO COMPORTAMENTAL LTDA;BE.ABA: INTERVENCAO COMPORTAMENTAL;2298;AVENIDA BORGES LEAL;APARECIDA;SANTAREM;PA;Baixo Amazonas;FONOAUDIOLOGIA  / TERAPIA OCUPACIONAL / NUTRICAO / PSICOLOGIA  / FISIOTERAPIA;;
BEABA DESENVOLVIMENTO E APRENDIZAGEM LTDA;BEABA -  DESENVOLVIMENTO E APRENDIZAGEM LTDA;536;AV PRESTATO FERREIRA MACHADO;JATIUCA;MACEIO;AL;Região 01;FISIOTERAPIA / PSICOLOGIA  / FONOAUDIOLOGIA  / TERAPIA OCUPACIONAL;;
BECKER LISENKO LTDA;BECKER LISENKO LTDA ME;2326;RUA QUINTINO BOCAIÚVA;CENTRO;GUARAPUAVA;PR;Guarapuava;PSICOLOGIA;36238330;
BELIEVE PSICOLOGIA E SAUDE LTDA;BELIEVE PSICOLOGIA E SAUDE LTDA;3502;AVENIDA CAMPOS SALES;OLARIA;PORTO VELHO;RO;Departamento de Epidemiologia;PSIQUIATRIA  / NUTRICAO / PSICOLOGIA  / FONOAUDIOLOGIA;;
BENILDE MARIA MIRANDA DA SILVA LTDA;INSTITUTO BALSENSE DE DESENVOLVIMENTO INFANTIL;83;RUA DA MANGUEIRA;CAJUEIRO;BALSAS;MA;Gerais de Balsas;TERAPIA OCUPACIONAL / NUTRICAO / PSICOLOGIA  / FONOAUDIOLOGIA;;
BERTO SERVICOS DE PSICOLOGIA LTDA;BERTO SERVICOS DE PSICOLOGIA;3958;RUA ARICANDUVA;ZONA II;UMUARAMA;PR;Umuarama;TERAPIA OCUPACIONAL / PSICOLOGIA;;
BERZIN PSIQUIATRIA LTDA;BERZIN PSIQUIATRIA;360;AVENIDA OROSIMBO MAIA;CENTRO;CAMPINAS;SP;Campinas;PSIQUIATRIA;;
BIANCA LEFOSSE LTDA;CLINICA LEFOSSE;292;AV DOM PEDRO II;CENTRO;SAO LOURENCO;MG;Varginha;FISIOTERAPIA;;
BIANCO SILVA CIA LTDA;BIANCO & SILVA;2498;ALAMEDA POLIVALENTE;JARDIM UIRAPURU;ALTAMIRA;PA;Rodovia Transamazônica;CIRURGIA DO APARELHO DIGESTIVO;;
BIO MEDICAL PREVENT LTDA;BIO MEDICAL PREVENT;790;RUA MARANHÃO;CENTRO;CASCAVEL;PR;Cascavel;RADIOTERAPIA;;
BIO RIM;BIO RIM;1578;RUA VINTE E SEIS;CENTRO;ITUIUTABA;MG;Ituiutaba;NEFROLOGIA;32682065;
BJ CONSULTORIO ODONTOLOGICO LTDA;SMART SMILE;166;R CRISPIM DE AMORIM COELHO;CENTRO;PETROLINA;PE;Petrolina;CIRURGIA E TRAUMATOLOGIA BUCO-MAXILO-FACIAIS;;
BLBT OFTALMOLOGIA AVANCADA LTDA;CLINICA DE OFTALMO E DERMATO INTEGRADA C O D I;78;AVENIDA QUINZE DE NOVEMBRO;CENTRO;ERECHIM;RS;CRS 11 Erechim;DERMATOLOGIA   / OFTALMOLOGIA;37126064;
BRANDAO BRITO SERVICOS MEDICOS ESPECIALIZADOS LTDA;ANGIOCLIN;1117;AVENIDA AZIZ MARON;JARDIM VITÓRIA;ITABUNA;BA;Itabuna;CIRURGIA VASCULAR / ANGIOLOGIA;32126523;
BRUNA APARECIDA RIBEIRO REL;BRUNA APARECIDA RIBEIRO REL;2047;RUA MINAS GERAIS;CENTRO;MEDIANEIRA;PR;Foz do Iguaçu;NUTRICAO;30000000;
BRUNA FRANCIELE DA SILVA CRUZ;BRUNA FRANCIELEDA SILVA CRUZ;434;RUA ECTORE ALBERTO BELTRAME;CENTRO;SANTA ROSA;RS;CRS 14 Santa Rosa;PSICOLOGIA;;
BRUNA RABELLO DE MORAES;Bruna Rabello de Moraes;524;RUA GENERAL JOÃO TELLES;BOM FIM;PORTO ALEGRE;RS;CRS 01 Porto Alegre;PSICOLOGIA;;
BRUNA SILVA CORDEIRO;BRUNA SILVA CORDEIRO;;;;;;;FISIOTERAPIA;;
BRUNO LODI SERVICOS MEDICOS LTDA;LODI PSIQUIATRIA;646;RUA EUDORO BERLINK;AUXILIADORA;PORTO ALEGRE;RS;CRS 01 Porto Alegre;PSIQUIATRIA;;
BS PSICOLOGIA LTDA;NEUROCENTER PSICOLOGIA AVANÇADA;25;QUADRA ACSE 1 RUA SE 1;PLANO DIRETOR SUL;PALMAS;TO;Região de Saúde do Capim Dourado;NUTRICAO / PSICOLOGIA;;
BSB OTORRINO SERVICO DE SAUDE LTDA;BSB OTORRINOLARINGOLOGIA E ONCOLOGIA;0;SGAS 613;ASA SUL;BRASILIA;DF;Distrito Federal;OTORRINOLARINGOLOGIA  / FONOAUDIOLOGIA;30327599;
BURIOLA E BONFIM SERVICOS OCUPACIONAIS LTDA;BURIOLA E BONFIM SERVICOS OCUPACIONAIS;2313;LORIANO PEIXOTO;NOSSA SENHORA APARECIDA - VILA;SAO JOSE DO RIO PRETO;SP;São José do Rio Preto;PSICOLOGIA;32343339;
BV COMERCIO DE APARELHOS AUDITIVOS E HOSPITALAR LT;;766;RUA PADRE CÍCERO;CENTRO;JUAZEIRO DO NORTE;CE;Juazeiro do Norte;FONOAUDIOLOGIA;35111868;
C P SAUDE SERVICOS LTDA;D SAUDE CENTRO MEDIC;62;RUA AGOSTINHO BEZERRA;CAJÁ;CARPINA;PE;Limoeiro;DERMATOLOGIA   / CLÍNICA MÉDICA / GINECOLOGIA E OBSTETRICIA  / CARDIOLOGIA  / ORTOPEDIA E TRAUMATOLOGIA  / RADIOLOGIA E DIAGNÓSTICO POR IMAGEM / OFTALMOLOGIA  / UROLOGIA;31962516;
C S MELO LTDA;ESPACO TERAPEUTICO CATIVAR;1156;RUA TREZE DE MAIO;CENTRO;IMPERATRIZ;MA;Tocantins;TERAPIA OCUPACIONAL / PSICOLOGIA  / FONOAUDIOLOGIA;;
C S SAUDE LTDA;C S SAUDE;428;RUA QUINZE DE NOVEMBRO;MIGUEL DE CASTRO MOREIRA;RIO GRANDE;RS;CRS 03 Pelotas;NUTRICAO;;
CAASA ESPACO DE NEURODESENVOLVIMENTO E DE COMUNICACAO LTDA;CAASA ESPACO DE NEURODESENVOLVIMENTO E DE COMUNICA;138;RUA HEITOR DE ANDRADE;JARDIM DAS AMÉRICAS;CURITIBA;PR;Metropolitana;PSICOLOGIA  / FONOAUDIOLOGIA  / TERAPIA OCUPACIONAL;;
CAD CENTRO DE ANESTESIOLOGIA E DOR SS LTDA;CAD CENTRO DE ANESTESIOLOGIA E DOR;148;RUA PASTOR SANDRESCKY;CENTRO I;BRUSQUE;SC;Brusque;ANESTESIOLOGIA;33553751;
CAIRES SAMPAIO MEDICINA ESPECIALIZADA LTDA;CAIRES SAMPAIO MEDICINA ESPECIALIZADA;103;CASTRO ALVES;CENTRO;SANTO ESTEVAO;BA;Feira de Santana;UROLOGIA  / GINECOLOGIA E OBSTETRICIA  / CLÍNICA MÉDICA / CIRURGIA VASCULAR / RADIOLOGIA E DIAGNÓSTICO POR IMAGEM / NEUROLOGIA;;
